{"anchors":[{"anchor_id":"a81a27e16a44bd48e78a07ab5b86f20fa411f89b4ebc66e358079ac79e150f8c","genesis_id":"974cd4da89feb9f7ae8e14d7b4359f4b76d8697f55e5793219c52e38b627b7de","network_id":"NEXUS-R013-SYNTHETIC","receipt_head":"","record_hash":"","schema":"nexus.pcx-durable-anchor/v0","sequence":"0","state_root":"569b9fd16d435b89619bcb48a3ffcbdffc714d14e2952507c483a2800cf04758","status_authority":"NONE"},{"anchor_id":"4f6364eaeb5d5330230d06b4451866c1d9ef60a6a157582f1e78dba36bde170e","genesis_id":"974cd4da89feb9f7ae8e14d7b4359f4b76d8697f55e5793219c52e38b627b7de","network_id":"NEXUS-R013-SYNTHETIC","receipt_head":"d146ac3fbfab4c96ce744825ceb18f6fdac74b9f2c399628c9f71d22c8b78452","record_hash":"c9dcecd08db734872b109af00d78ef4396dbde49e8c8e9e19449e991351003d3","schema":"nexus.pcx-durable-anchor/v0","sequence":"1","state_root":"cac02fb9be0da0f8d4780da6e67b41904aa79dae05024d3ee5124b457d034845","status_authority":"NONE"},{"anchor_id":"baf8b6848040ed2584e2b48182a7988b00af05cbad30b3ed13e681247657bb2d","genesis_id":"974cd4da89feb9f7ae8e14d7b4359f4b76d8697f55e5793219c52e38b627b7de","network_id":"NEXUS-R013-SYNTHETIC","receipt_head":"67db7b44b539b6cc35374e21a6b2a30bb0f96c9b3765387665adf2c58ba84122","record_hash":"8282c1a6f472b9d1cdf8adca1404582cfb275e58feb7f5a96d04df9e55aeb304","schema":"nexus.pcx-durable-anchor/v0","sequence":"2","state_root":"92ddeac51acdc05d4b59c7283e523e1cf770ddface494bfb986d3f1878c6dc24","status_authority":"NONE"},{"anchor_id":"f45c568fcb8086aedb5c9a066a4940b09209c289aa94677da8648b2a7cc6ad21","genesis_id":"974cd4da89feb9f7ae8e14d7b4359f4b76d8697f55e5793219c52e38b627b7de","network_id":"NEXUS-R013-SYNTHETIC","receipt_head":"d0dd980a8422988c57b2b6925fbcbd69035c29d2566fcd7552854f567fc9a353","record_hash":"8541a2b0d4a475a18f36649dd65e3d152d0630a030ba528c75b3ac04905e4de9","schema":"nexus.pcx-durable-anchor/v0","sequence":"3","state_root":"130468a58b767560e9de3ae3c5ab7802e52cd2763e935c28674648081b244dff","status_authority":"NONE"},{"anchor_id":"e67faa207bd5847031e1d139d85243699da02311c4a764de0f66f6019b96a7b8","genesis_id":"974cd4da89feb9f7ae8e14d7b4359f4b76d8697f55e5793219c52e38b627b7de","network_id":"NEXUS-R013-SYNTHETIC","receipt_head":"fedc92b971f0ea59586678297a981c950d2ac8646e8cf30f79bffc7537893ffc","record_hash":"77e10a0c9be99d788dcaa4d72e96d35056431adda2f6d706b88d40c1464d4ad0","schema":"nexus.pcx-durable-anchor/v0","sequence":"4","state_root":"1b28ac32d6067a7b1bd2ec8b7097b341d891a2793a63c606da0c9eecf221598f","status_authority":"NONE"}],"closure":"CLOSED_EXPORTED_PREFIX","genesis_b64":"eyJnZW5lc2lzX2lkIjoiOTc0Y2Q0ZGE4OWZlYjlmN2FlOGUxNGQ3YjQzNTlmNGI3NmQ4Njk3ZjU1ZTU3OTMyMTljNTJlMzhiNjI3YjdkZSIsIm5ldHdvcmtfaWQiOiJORVhVUy1SMDEzLVNZTlRIRVRJQyIsIm91dHB1dHMiOlt7ImFtb3VudCI6IjEwMDAiLCJvd25lcl9wdWJsaWNfa2V5IjoiYmQzMWRjZjU0ZDliMzI1NWFiOTE3Njg1ZGU1NmFmZDlhNTkzYzUwMzA4NmM5YTAyYmM2OTJiYzQwYTI4Y2RhYSJ9XSwic2NoZW1hIjoibmV4dXMucGN4LWdlbmVzaXMvdjAiLCJzdGF0dXNfYXV0aG9yaXR5IjoiTk9ORSIsInVuaXRfbGFiZWwiOiJSMDEzLVNZTlRIRVRJQy1DTEFJTSJ9","genesis_id":"974cd4da89feb9f7ae8e14d7b4359f4b76d8697f55e5793219c52e38b627b7de","genesis_raw_sha256":"3de010e5d73f4cf6e71d7c916c84f21177eab8abb322a517d7ee8abd2fe34499","initial_state_root":"569b9fd16d435b89619bcb48a3ffcbdffc714d14e2952507c483a2800cf04758","max_records":"256","network_id":"NEXUS-R013-SYNTHETIC","record_count":"4","records":[{"next_state_root":"cac02fb9be0da0f8d4780da6e67b41904aa79dae05024d3ee5124b457d034845","previous_record_hash":"","previous_state_root":"569b9fd16d435b89619bcb48a3ffcbdffc714d14e2952507c483a2800cf04758","receipt_b64":"eyJjcmVhdGVkX291dHB1dF9pZHMiOlsiYjU1Nzk4YjcyMjYyNzZlYjcyN2I2ZjdmMzVhMmQ0Njg5YzBhMjNlNmYyOGY2YjA5NzcxYmFhYzdhOWExZjZiMSIsImUxN2U5YTgyZGYxMGY1MGQwYjQ5Y2Q1MTdkY2JkN2VmNDNmZmY2OTdiNjQyZTYyZDQ3MTBhMzAyYTJhYzdmZDIiXSwiZGVjaXNpb24iOiJDQU5ESURBVEVfQUNDRVBURUQiLCJnZW5lc2lzX2lkIjoiOTc0Y2Q0ZGE4OWZlYjlmN2FlOGUxNGQ3YjQzNTlmNGI3NmQ4Njk3ZjU1ZTU3OTMyMTljNTJlMzhiNjI3YjdkZSIsIm5ldHdvcmtfaWQiOiJORVhVUy1SMDEzLVNZTlRIRVRJQyIsIm5leHRfc3RhdGVfcm9vdCI6ImNhYzAyZmI5YmUwZGEwZjhkNDc4MGRhNmU2N2I0MTkwNGFhNzlkYWUwNTAyNGQzZWU1MTI0YjQ1N2QwMzQ4NDUiLCJwcmV2aW91c19yZWNlaXB0X2hhc2giOiIiLCJwcmV2aW91c19zdGF0ZV9yb290IjoiNTY5YjlmZDE2ZDQzNWI4OTYxOWJjYjQ4YTNmZmNiZGZmYzcxNGQxNGUyOTUyNTA3YzQ4M2EyODAwY2YwNDc1OCIsInJlYXNvbl9jb2RlIjoiVkFMSURfQ09OU0VSVkVEX1RSQU5TRkVSIiwicmVjZWlwdF9oYXNoIjoiZDE0NmFjM2ZiZmFiNGM5NmNlNzQ0ODI1Y2ViMThmNmZkYWM3NGI5ZjJjMzk5NjI4YzlmNzFkMjJjOGI3ODQ1MiIsInNjaGVtYSI6Im5leHVzLnBjeC12YWx1ZS1yZWNlaXB0L3YwIiwic2VxdWVuY2UiOiIxIiwic3BlbnRfb3V0cHV0X2lkcyI6WyJiOTQ3NTc2NWQxMjIwNWFkYTcxZDE2MzVjMzQwY2JhOWIwNmY2MTQ4YWFkODMxNTRjNTlhMmI3ZDFhZDI4NGFjIl0sInN0YXR1c19hdXRob3JpdHkiOiJOT05FIiwidHhfaGFzaCI6IjE2NjU4ZjA3ZWE5ZDY3YmEyY2ZkZjM1NDJlMmVhOWVmNGZhNjY5ODZhYjE4NTZiZmQxYjQ4NTJhZTZiOWVlMTEiLCJ0eF9pZCI6IjRhZjYwMzczODQ0M2YxYmZlZmUzMjg0NTUyODFiZjEzMTYxNTk4NjFjNTMzZjk5NjU5NWQ1ZTBiOTcwNTA4MzYifQ==","receipt_hash":"d146ac3fbfab4c96ce744825ceb18f6fdac74b9f2c399628c9f71d22c8b78452","receipt_raw_sha256":"e6e791fa42e43c1f70d35cbab313e342be9f89b0c691db4dd2f47a859c9b446d","record_hash":"c9dcecd08db734872b109af00d78ef4396dbde49e8c8e9e19449e991351003d3","schema":"nexus.pcx-durable-record/v0","sequence":"1","status_authority":"NONE","tx_b64":"eyJhbmNob3Jfc3RhdGVfcm9vdCI6IjU2OWI5ZmQxNmQ0MzViODk2MTliY2I0OGEzZmZjYmRmZmM3MTRkMTRlMjk1MjUwN2M0ODNhMjgwMGNmMDQ3NTgiLCJnZW5lc2lzX2lkIjoiOTc0Y2Q0ZGE4OWZlYjlmN2FlOGUxNGQ3YjQzNTlmNGI3NmQ4Njk3ZjU1ZTU3OTMyMTljNTJlMzhiNjI3YjdkZSIsImlucHV0cyI6W3siY3JlYXRpbmdfdHhfaWQiOiI5NzRjZDRkYTg5ZmViOWY3YWU4ZTE0ZDdiNDM1OWY0Yjc2ZDg2OTdmNTVlNTc5MzIxOWM1MmUzOGI2MjdiN2RlIiwib3V0cHV0X2lkIjoiYjk0NzU3NjVkMTIyMDVhZGE3MWQxNjM1YzM0MGNiYTliMDZmNjE0OGFhZDgzMTU0YzU5YTJiN2QxYWQyODRhYyIsIm91dHB1dF9pbmRleCI6IjAifV0sIm5ldHdvcmtfaWQiOiJORVhVUy1SMDEzLVNZTlRIRVRJQyIsIm5vbmNlIjoiM2MyYWM0NWM5YzJlOWFjNDRlNTYyODA3MzBiOThhYmVkMzBhNzc2Y2VjODQyODU3NDRjNTc1ZTg3Y2NmOTBjNCIsIm91dHB1dHMiOlt7ImFtb3VudCI6IjYwMCIsIm93bmVyX3B1YmxpY19rZXkiOiJlMjEzZTBhZDgwOTI0NTMxNjc5MDU2NjUzYWFiYjRhNmFkOTkzN2U0MmVjYWMzYzVlMGZlMmM4MmMyMTJiMDQ5In0seyJhbW91bnQiOiI0MDAiLCJvd25lcl9wdWJsaWNfa2V5IjoiYmQzMWRjZjU0ZDliMzI1NWFiOTE3Njg1ZGU1NmFmZDlhNTkzYzUwMzA4NmM5YTAyYmM2OTJiYzQwYTI4Y2RhYSJ9XSwic2NoZW1hIjoibmV4dXMucGN4LXRyYW5zZmVyL3YwIiwic3RhdHVzX2F1dGhvcml0eSI6Ik5PTkUiLCJ0eF9pZCI6IjRhZjYwMzczODQ0M2YxYmZlZmUzMjg0NTUyODFiZjEzMTYxNTk4NjFjNTMzZjk5NjU5NWQ1ZTBiOTcwNTA4MzYiLCJ3aXRuZXNzZXMiOlt7ImlucHV0X2luZGV4IjoiMCIsIm93bmVyX3B1YmxpY19rZXkiOiJiZDMxZGNmNTRkOWIzMjU1YWI5MTc2ODVkZTU2YWZkOWE1OTNjNTAzMDg2YzlhMDJiYzY5MmJjNDBhMjhjZGFhIiwic2lnbmF0dXJlIjoiOTViYTU0ODZlMWExMmM2NGRkYWUxZDkxNzhmOWY2MTBkMDA0MTBmMzFjNTNkYmUyMjlmZTA5MTA4NzAwNWZkNDFkMjAwOGRjODAyNGNjNTc1M2VkOWNiZTM2YjRiNGQwYzIwNjVkNjRjOWE3ZThkYzNlYjYwOThjYTA3NjYxMDkifV19","tx_id":"4af603738443f1bfefe328455281bf1316159861c533f996595d5e0b97050836","tx_sha256":"5200c3167724fe534cec8fc8f0836e7f2e0548f6d5c39b0233c678c75123eca0"},{"next_state_root":"92ddeac51acdc05d4b59c7283e523e1cf770ddface494bfb986d3f1878c6dc24","previous_record_hash":"c9dcecd08db734872b109af00d78ef4396dbde49e8c8e9e19449e991351003d3","previous_state_root":"cac02fb9be0da0f8d4780da6e67b41904aa79dae05024d3ee5124b457d034845","receipt_b64":"eyJjcmVhdGVkX291dHB1dF9pZHMiOlsiYTc4N2U5MmI0M2ZmYzZkODkwMTJlYTg5YTczYjE5NWUyN2I0OGEzNGFlNmYyZDRjZmVlNDU3NDRhZWUxY2FmNiIsIjAzZDM5NTQ4NzE1OWM1NDhjZWFjMTM0MWI4OWY4ZmEyOWU5MjQ3OGUzYTBlMzYwMDQyYjEyYWU5MzYxYzVkM2QiXSwiZGVjaXNpb24iOiJDQU5ESURBVEVfQUNDRVBURUQiLCJnZW5lc2lzX2lkIjoiOTc0Y2Q0ZGE4OWZlYjlmN2FlOGUxNGQ3YjQzNTlmNGI3NmQ4Njk3ZjU1ZTU3OTMyMTljNTJlMzhiNjI3YjdkZSIsIm5ldHdvcmtfaWQiOiJORVhVUy1SMDEzLVNZTlRIRVRJQyIsIm5leHRfc3RhdGVfcm9vdCI6IjkyZGRlYWM1MWFjZGMwNWQ0YjU5YzcyODNlNTIzZTFjZjc3MGRkZmFjZTQ5NGJmYjk4NmQzZjE4NzhjNmRjMjQiLCJwcmV2aW91c19yZWNlaXB0X2hhc2giOiJkMTQ2YWMzZmJmYWI0Yzk2Y2U3NDQ4MjVjZWIxOGY2ZmRhYzc0YjlmMmMzOTk2MjhjOWY3MWQyMmM4Yjc4NDUyIiwicHJldmlvdXNfc3RhdGVfcm9vdCI6ImNhYzAyZmI5YmUwZGEwZjhkNDc4MGRhNmU2N2I0MTkwNGFhNzlkYWUwNTAyNGQzZWU1MTI0YjQ1N2QwMzQ4NDUiLCJyZWFzb25fY29kZSI6IlZBTElEX0NPTlNFUlZFRF9UUkFOU0ZFUiIsInJlY2VpcHRfaGFzaCI6IjY3ZGI3YjQ0YjUzOWI2Y2MzNTM3NGUyMWE2YjJhMzBiYjBmOTZjOWIzNzY1Mzg3NjY1YWRmMmM1OGJhODQxMjIiLCJzY2hlbWEiOiJuZXh1cy5wY3gtdmFsdWUtcmVjZWlwdC92MCIsInNlcXVlbmNlIjoiMiIsInNwZW50X291dHB1dF9pZHMiOlsiYjU1Nzk4YjcyMjYyNzZlYjcyN2I2ZjdmMzVhMmQ0Njg5YzBhMjNlNmYyOGY2YjA5NzcxYmFhYzdhOWExZjZiMSJdLCJzdGF0dXNfYXV0aG9yaXR5IjoiTk9ORSIsInR4X2hhc2giOiJkMWNiNTA3ZGViODQ4MDc0NGMwNTBjYTcyM2ZmZjcxMDdiZDc4Mjk3ODg5YTRkMmVmZmZmZmE4NjY4MWE5MTczIiwidHhfaWQiOiI1ODhkYzMyOTAyZTI0ZjdhNTFiM2EyOWM5NTg3OGNiM2Y3YzAyNzA4YTE2ZjY4ZGNiYmIwM2JiOTM2NDBiMGVhIn0=","receipt_hash":"67db7b44b539b6cc35374e21a6b2a30bb0f96c9b3765387665adf2c58ba84122","receipt_raw_sha256":"ba1525220f220b644879ce33bd1b5d8aaa82090611ecd91ecd02226cce36c304","record_hash":"8282c1a6f472b9d1cdf8adca1404582cfb275e58feb7f5a96d04df9e55aeb304","schema":"nexus.pcx-durable-record/v0","sequence":"2","status_authority":"NONE","tx_b64":"eyJhbmNob3Jfc3RhdGVfcm9vdCI6ImNhYzAyZmI5YmUwZGEwZjhkNDc4MGRhNmU2N2I0MTkwNGFhNzlkYWUwNTAyNGQzZWU1MTI0YjQ1N2QwMzQ4NDUiLCJnZW5lc2lzX2lkIjoiOTc0Y2Q0ZGE4OWZlYjlmN2FlOGUxNGQ3YjQzNTlmNGI3NmQ4Njk3ZjU1ZTU3OTMyMTljNTJlMzhiNjI3YjdkZSIsImlucHV0cyI6W3siY3JlYXRpbmdfdHhfaWQiOiI0YWY2MDM3Mzg0NDNmMWJmZWZlMzI4NDU1MjgxYmYxMzE2MTU5ODYxYzUzM2Y5OTY1OTVkNWUwYjk3MDUwODM2Iiwib3V0cHV0X2lkIjoiYjU1Nzk4YjcyMjYyNzZlYjcyN2I2ZjdmMzVhMmQ0Njg5YzBhMjNlNmYyOGY2YjA5NzcxYmFhYzdhOWExZjZiMSIsIm91dHB1dF9pbmRleCI6IjAifV0sIm5ldHdvcmtfaWQiOiJORVhVUy1SMDEzLVNZTlRIRVRJQyIsIm5vbmNlIjoiOTQyZjRlMGZjNjk2NjM0Y2NjZmEwY2YyM2RiM2YzZTRhYmRhNGFlN2M5MjNlOTQ1YmJkODhiYTE5YzljZjE2NiIsIm91dHB1dHMiOlt7ImFtb3VudCI6IjI1MCIsIm93bmVyX3B1YmxpY19rZXkiOiIwYTIwNzEwMjgyMzIxN2I3ZTcyMjg0NzkxNmJhOTBmZmMxZDI0OWQ3N2I3MjIwZjY0NmZiNjMzYWFjZGU1NGM3In0seyJhbW91bnQiOiIzNTAiLCJvd25lcl9wdWJsaWNfa2V5IjoiZTIxM2UwYWQ4MDkyNDUzMTY3OTA1NjY1M2FhYmI0YTZhZDk5MzdlNDJlY2FjM2M1ZTBmZTJjODJjMjEyYjA0OSJ9XSwic2NoZW1hIjoibmV4dXMucGN4LXRyYW5zZmVyL3YwIiwic3RhdHVzX2F1dGhvcml0eSI6Ik5PTkUiLCJ0eF9pZCI6IjU4OGRjMzI5MDJlMjRmN2E1MWIzYTI5Yzk1ODc4Y2IzZjdjMDI3MDhhMTZmNjhkY2JiYjAzYmI5MzY0MGIwZWEiLCJ3aXRuZXNzZXMiOlt7ImlucHV0X2luZGV4IjoiMCIsIm93bmVyX3B1YmxpY19rZXkiOiJlMjEzZTBhZDgwOTI0NTMxNjc5MDU2NjUzYWFiYjRhNmFkOTkzN2U0MmVjYWMzYzVlMGZlMmM4MmMyMTJiMDQ5Iiwic2lnbmF0dXJlIj